{
  "presetId": "demo-canada-ottawa",
  "version": "1.0.0",
  "jurisdiction": {
    "city": "Ottawa",
    "provinceOrState": "Ontario"
  },
  "supportedItems": [
    "aluminum-can",
    "granola-bar",
    "pickled-radish"
  ],
  "itemMappings": [
    {
      "itemType": "aluminum-can",
      "disposalMethod": "recycle"
    },
    {
      "itemType": "pickled-radish",
      "disposalMethod": "compost"
    },
    {
      "itemType": "granola-bar",
      "disposalMethod": "garbage"
    }
  ],
  "zoneMapping": {
    "right": "recycle",
    "middle": "compost",
    "left": "garbage"
  },
  "lowConfidenceThreshold": 0.95
}